{
  "schema": "phyzical-episode-v1",
  "episode_id": "EP_a41b7c2e",
  "task_id": "block_sorting_01",
  "task_description": "Pick up the red block and place it in the red zone.",
  "contributor": "0x94e1b2aa38cf01d94f7e2b9a4410c2c86ac3c7f2",
  "robot_profile": "generic-arm-6dof",
  "control_mode": "ee_drag_ik",
  "sim": {
    "engine": "unity_webgl",
    "physics_hz": 60,
    "record_hz": 30
  },
  "duration_s": 3.0,
  "success": true,
  "trajectory": [
    {
      "t": 0.0333,
      "joint_pos": [
        0.0,
        0.9,
        -1.4,
        -0.57,
        0.0,
        0.07
      ],
      "ee_pose": {
        "xyz": [
          0.0,
          0.35,
          0.6
        ],
        "quat": [
          0,
          0,
          0.7071,
          0.7071
        ]
      },
      "gripper": 0.07,
      "object_poses": {
        "block_red_01": {
          "xyz": [
            0.42,
            0.02,
            0.85
          ],
          "quat": [
            0,
            0,
            0,
            1
          ]
        },
        "zone_red": {
          "xyz": [
            -0.3,
            0.001,
            0.8
          ],
          "quat": [
            0,
            0,
            0,
            1
          ]
        }
      },
      "action": {
        "type": "ee_delta",
        "cmd": [
          0.01,
          -0.0,
          0.0
        ]
      }
    },
    {
      "t": 0.0667,
      "joint_pos": [
        0.0136,
        0.8824,
        -1.3788,
        -0.5736,
        0.0,
        0.07
      ],
      "ee_pose": {
        "xyz": [
          0.0104,
          0.3586,
          0.6062
        ],
        "quat": [
          0,
          0,
          0.7071,
          0.7071
        ]
      },
      "gripper": 0.07,
      "object_poses": {
        "block_red_01": {
          "xyz": [
            0.42,
            0.02,
            0.85
          ],
          "quat": [
            0,
            0,
            0,
            1
          ]
        },
        "zone_red": {
          "xyz": [
            -0.3,
            0.001,
            0.8
          ],
          "quat": [
            0,
            0,
            0,
            1
          ]
        }
      },
      "action": {
        "type": "ee_delta",
        "cmd": [
          0.01,
          -0.0002,
          0.0
        ]
      }
    },
    {
      "t": 0.1,
      "joint_pos": [
        0.0272,
        0.8647,
        -1.3577,
        -0.577,
        0.0,
        0.07
      ],
      "ee_pose": {
        "xyz": [
          0.0208,
          0.3671,
          0.6124
        ],
        "quat": [
          0,
          0,
          0.7071,
          0.7071
        ]
      },
      "gripper": 0.07,
      "object_poses": {
        "block_red_01": {
          "xyz": [
            0.42,
            0.02,
            0.85
          ],
          "quat": [
            0,
            0,
            0,
            1
          ]
        },
        "zone_red": {
          "xyz": [
            -0.3,
            0.001,
            0.8
          ],
          "quat": [
            0,
            0,
            0,
            1
          ]
        }
      },
      "action": {
        "type": "ee_delta",
        "cmd": [
          0.01,
          -0.0004,
          0.0
        ]
      }
    },
    {
      "t": 0.1333,
      "joint_pos": [
        0.0408,
        0.8472,
        -1.3366,
        -0.5806,
        0.0,
        0.07
      ],
      "ee_pose": {
        "xyz": [
          0.0311,
          0.3755,
          0.6185
        ],
        "quat": [
          0,
          0,
          0.7071,
          0.7071
        ]
      },
      "gripper": 0.07,
      "object_poses": {
        "block_red_01": {
          "xyz": [
            0.42,
            0.02,
            0.85
          ],
          "quat": [
            0,
            0,
            0,
            1
          ]
        },
        "zone_red": {
          "xyz": [
            -0.3,
            0.001,
            0.8
          ],
          "quat": [
            0,
            0,
            0,
            1
          ]
        }
      },
      "action": {
        "type": "ee_delta",
        "cmd": [
          0.0099,
          -0.0005,
          0.0
        ]
      }
    },
    {
      "t": 0.1667,
      "joint_pos": [
        0.0544,
        0.8296,
        -1.3156,
        -0.584,
        0.0,
        0.07
      ],
      "ee_pose": {
        "xyz": [
          0.0415,
          0.3836,
          0.6247
        ],
        "quat": [
          0,
          0,
          0.7071,
          0.7071
        ]
      },
      "gripper": 0.07,
      "object_poses": {
        "block_red_01": {
          "xyz": [
            0.42,
            0.02,
            0.85
          ],
          "quat": [
            0,
            0,
            0,
            1
          ]
        },
        "zone_red": {
          "xyz": [
            -0.3,
            0.001,
            0.8
          ],
          "quat": [
            0,
            0,
            0,
            1
          ]
        }
      },
      "action": {
        "type": "ee_delta",
        "cmd": [
          0.0099,
          -0.0007,
          0.0
        ]
      }
    },
    {
      "t": 0.2,
      "joint_pos": [
        0.068,
        0.8122,
        -1.2947,
        -0.5875,
        0.0,
        0.07
      ],
      "ee_pose": {
        "xyz": [
          0.0519,
          0.3914,
          0.6309
        ],
        "quat": [
          0,
          0,
          0.7071,
          0.7071
        ]
      },
      "gripper": 0.07,
      "object_poses": {
        "block_red_01": {
          "xyz": [
            0.42,
            0.02,
            0.85
          ],
          "quat": [
            0,
            0,
            0,
            1
          ]
        },
        "zone_red": {
          "xyz": [
            -0.3,
            0.001,
            0.8
          ],
          "quat": [
            0,
            0,
            0,
            1
          ]
        }
      },
      "action": {
        "type": "ee_delta",
        "cmd": [
          0.0099,
          -0.0009,
          0.0
        ]
      }
    },
    {
      "t": 0.2333,
      "joint_pos": [
        0.0816,
        0.7949,
        -1.2739,
        -0.591,
        0.0,
        0.07
      ],
      "ee_pose": {
        "xyz": [
          0.0623,
          0.3989,
          0.6371
        ],
        "quat": [
          0,
          0,
          0.7071,
          0.7071
        ]
      },
      "gripper": 0.07,
      "object_poses": {
        "block_red_01": {
          "xyz": [
            0.42,
            0.02,
            0.85
          ],
          "quat": [
            0,
            0,
            0,
            1
          ]
        },
        "zone_red": {
          "xyz": [
            -0.3,
            0.001,
            0.8
          ],
          "quat": [
            0,
            0,
            0,
            1
          ]
        }
      },
      "action": {
        "type": "ee_delta",
        "cmd": [
          0.0098,
          -0.0011,
          0.0
        ]
      }
    },
    {
      "t": 0.2667,
      "joint_pos": [
        0.0952,
        0.7777,
        -1.2532,
        -0.5945,
        0.0,
        0.07
      ],
      "ee_pose": {
        "xyz": [
          0.0727,
          0.4059,
          0.6433
        ],
        "quat": [
          0,
          0,
          0.7071,
          0.7071
        ]
      },
      "gripper": 0.07,
      "object_poses": {
        "block_red_01": {
          "xyz": [
            0.42,
            0.02,
            0.85
          ],
          "quat": [
            0,
            0,
            0,
            1
          ]
        },
        "zone_red": {
          "xyz": [
            -0.3,
            0.001,
            0.8
          ],
          "quat": [
            0,
            0,
            0,
            1
          ]
        }
      },
      "action": {
        "type": "ee_delta",
        "cmd": [
          0.0097,
          -0.0013,
          0.0
        ]
      }
    },
    {
      "t": 0.3,
      "joint_pos": [
        0.1088,
        0.7607,
        -1.2328,
        -0.5979,
        0.0,
        0.07
      ],
      "ee_pose": {
        "xyz": [
          0.0831,
          0.4124,
          0.6494
        ],
        "quat": [
          0,
          0,
          0.7071,
          0.7071
        ]
      },
      "gripper": 0.07,
      "object_poses": {
        "block_red_01": {
          "xyz": [
            0.42,
            0.02,
            0.85
          ],
          "quat": [
            0,
            0,
            0,
            1
          ]
        },
        "zone_red": {
          "xyz": [
            -0.3,
            0.001,
            0.8
          ],
          "quat": [
            0,
            0,
            0,
            1
          ]
        }
      },
      "action": {
        "type": "ee_delta",
        "cmd": [
          0.0096,
          -0.0014,
          0.0
        ]
      }
    },
    {
      "t": 0.3333,
      "joint_pos": [
        0.1224,
        0.7438,
        -1.2126,
        -0.6012,
        0.0,
        0.07
      ],
      "ee_pose": {
        "xyz": [
          0.0934,
          0.4183,
          0.6556
        ],
        "quat": [
          0,
          0,
          0.7071,
          0.7071
        ]
      },
      "gripper": 0.07,
      "object_poses": {
        "block_red_01": {
          "xyz": [
            0.42,
            0.02,
            0.85
          ],
          "quat": [
            0,
            0,
            0,
            1
          ]
        },
        "zone_red": {
          "xyz": [
            -0.3,
            0.001,
            0.8
          ],
          "quat": [
            0,
            0,
            0,
            1
          ]
        }
      },
      "action": {
        "type": "ee_delta",
        "cmd": [
          0.0095,
          -0.0016,